{
  "schema_version": "0.1",
  "generated_at": "2026-06-01T07:40:56.484629Z",
  "source_artifacts": {
    "cross_validation_plan": "/Users/kangmin/Documents/excel-workbook-editing/review-packages/workbook-understanding/mbp-2026-02-cross-validation-plan.json",
    "visual_features": "/Users/kangmin/Documents/excel-workbook-editing/review-packages/workbook-understanding/mbp-2026-02-visual-features.json"
  },
  "method": {
    "name": "deterministic_cross_validation_gate_execution",
    "authority": "evidence_gate_status_not_final_document_graph_truth",
    "decision_policy": "Accept only gates with sufficient deterministic visual evidence and no view-state or quality blockers. Otherwise retain review_required."
  },
  "gate_results": [
    {
      "id": "result_gate_target_결제_수수료_cell_region_1_boundary_confirmation",
      "type": "cross_validation_gate_result",
      "gate_check_id": "gate_target_결제_수수료_cell_region_1_boundary_confirmation",
      "target_id": "target_결제_수수료_cell_region_1",
      "gate_type": "boundary_confirmation",
      "status": "accepted",
      "reason": "deterministic_visual_evidence_available",
      "confidence": 0.82,
      "target_type": "pipeline_output",
      "sheet": "결제&수수료",
      "range": "A1:C11",
      "feature_result_id": "features_coord_quality_capture_target_결제_수수료_cell_region_1",
      "feature_status": "detected",
      "layout_signals": [
        "visible_content_bbox",
        "grid_or_table_line_structure"
      ],
      "deterministic_inputs": [
        "gate_split_결제_수수료_row_band_1_c1_c2",
        "split_결제_수수료_row_band_1_c1_c2"
      ],
      "evidence_refs": [
        "gate_target_결제_수수료_cell_region_1_boundary_confirmation",
        "gate_split_결제_수수료_row_band_1_c1_c2",
        "split_결제_수수료_row_band_1_c1_c2",
        "gate_split_결제_수수료_row_band_1_c2_c3",
        "pipeline_결제_수수료_cell_region_1",
        "coord_quality_capture_target_결제_수수료_cell_region_1",
        "capture_target_결제_수수료_cell_region_1",
        "features_coord_quality_capture_target_결제_수수료_cell_region_1"
      ],
      "notes": "boundary_confirmation accepted from deterministic visual evidence: visible_content_bbox, grid_or_table_line_structure."
    },
    {
      "id": "result_gate_target_결제_수수료_cell_region_1_formula_summary_visual_alignment",
      "type": "cross_validation_gate_result",
      "gate_check_id": "gate_target_결제_수수료_cell_region_1_formula_summary_visual_alignment",
      "target_id": "target_결제_수수료_cell_region_1",
      "gate_type": "formula_summary_visual_alignment",
      "status": "accepted",
      "reason": "deterministic_visual_evidence_available",
      "confidence": 0.82,
      "target_type": "pipeline_output",
      "sheet": "결제&수수료",
      "range": "A1:C11",
      "feature_result_id": "features_coord_quality_capture_target_결제_수수료_cell_region_1",
      "feature_status": "detected",
      "layout_signals": [
        "visible_content_bbox",
        "grid_or_table_line_structure"
      ],
      "deterministic_inputs": [
        "pipeline_결제_수수료_cell_region_1",
        "group_결제_수수료_row_band_1_1",
        "group_결제_수수료_row_band_1_2"
      ],
      "evidence_refs": [
        "gate_target_결제_수수료_cell_region_1_formula_summary_visual_alignment",
        "pipeline_결제_수수료_cell_region_1",
        "group_결제_수수료_row_band_1_1",
        "group_결제_수수료_row_band_1_2",
        "gate_split_결제_수수료_row_band_1_c1_c2",
        "gate_split_결제_수수료_row_band_1_c2_c3",
        "coord_quality_capture_target_결제_수수료_cell_region_1",
        "capture_target_결제_수수료_cell_region_1",
        "features_coord_quality_capture_target_결제_수수료_cell_region_1"
      ],
      "notes": "formula_summary_visual_alignment accepted from deterministic visual evidence: visible_content_bbox, grid_or_table_line_structure."
    },
    {
      "id": "result_gate_target_결제_수수료_pivot_pivottable1_pivot_cache_visual_alignment",
      "type": "cross_validation_gate_result",
      "gate_check_id": "gate_target_결제_수수료_pivot_pivottable1_pivot_cache_visual_alignment",
      "target_id": "target_결제_수수료_pivot_pivottable1",
      "gate_type": "pivot_cache_visual_alignment",
      "status": "review_required",
      "reason": "capture_required",
      "confidence": 0.25,
      "target_type": "pipeline_output",
      "sheet": "결제&수수료",
      "range": "A3:B10",
      "feature_result_id": null,
      "feature_status": null,
      "layout_signals": [],
      "deterministic_inputs": [
        "pipeline_결제_수수료_pivot_pivottable1",
        "rel_결제_수수료_pivot_pivottable1__pivot_cache_source"
      ],
      "evidence_refs": [
        "gate_target_결제_수수료_pivot_pivottable1_pivot_cache_visual_alignment",
        "pipeline_결제_수수료_pivot_pivottable1",
        "rel_결제_수수료_pivot_pivottable1__pivot_cache_source"
      ],
      "notes": "pivot_cache_visual_alignment requires review: capture_required."
    },
    {
      "id": "result_gate_target_결제_수수료_pivot_피벗_테이블1_pivot_cache_visual_alignment",
      "type": "cross_validation_gate_result",
      "gate_check_id": "gate_target_결제_수수료_pivot_피벗_테이블1_pivot_cache_visual_alignment",
      "target_id": "target_결제_수수료_pivot_피벗_테이블1",
      "gate_type": "pivot_cache_visual_alignment",
      "status": "review_required",
      "reason": "capture_required",
      "confidence": 0.25,
      "target_type": "pipeline_output",
      "sheet": "결제&수수료",
      "range": "A15:B33",
      "feature_result_id": null,
      "feature_status": null,
      "layout_signals": [],
      "deterministic_inputs": [
        "pipeline_결제_수수료_pivot_피벗_테이블1",
        "rel_결제_수수료_pivot_피벗_테이블1__pivot_cache_source"
      ],
      "evidence_refs": [
        "gate_target_결제_수수료_pivot_피벗_테이블1_pivot_cache_visual_alignment",
        "pipeline_결제_수수료_pivot_피벗_테이블1",
        "rel_결제_수수료_pivot_피벗_테이블1__pivot_cache_source"
      ],
      "notes": "pivot_cache_visual_alignment requires review: capture_required."
    },
    {
      "id": "result_gate_target_결제_수수료_pivot_피벗_테이블10_pivot_cache_visual_alignment",
      "type": "cross_validation_gate_result",
      "gate_check_id": "gate_target_결제_수수료_pivot_피벗_테이블10_pivot_cache_visual_alignment",
      "target_id": "target_결제_수수료_pivot_피벗_테이블10",
      "gate_type": "pivot_cache_visual_alignment",
      "status": "review_required",
      "reason": "capture_required",
      "confidence": 0.25,
      "target_type": "pipeline_output",
      "sheet": "결제&수수료",
      "range": "A200:B203",
      "feature_result_id": null,
      "feature_status": null,
      "layout_signals": [],
      "deterministic_inputs": [
        "pipeline_결제_수수료_pivot_피벗_테이블10",
        "rel_결제_수수료_pivot_피벗_테이블10__pivot_cache_source"
      ],
      "evidence_refs": [
        "gate_target_결제_수수료_pivot_피벗_테이블10_pivot_cache_visual_alignment",
        "pipeline_결제_수수료_pivot_피벗_테이블10",
        "rel_결제_수수료_pivot_피벗_테이블10__pivot_cache_source"
      ],
      "notes": "pivot_cache_visual_alignment requires review: capture_required."
    },
    {
      "id": "result_gate_target_결제_수수료_pivot_피벗_테이블11_pivot_cache_visual_alignment",
      "type": "cross_validation_gate_result",
      "gate_check_id": "gate_target_결제_수수료_pivot_피벗_테이블11_pivot_cache_visual_alignment",
      "target_id": "target_결제_수수료_pivot_피벗_테이블11",
      "gate_type": "pivot_cache_visual_alignment",
      "status": "review_required",
      "reason": "capture_required",
      "confidence": 0.25,
      "target_type": "pipeline_output",
      "sheet": "결제&수수료",
      "range": "A207:B210",
      "feature_result_id": null,
      "feature_status": null,
      "layout_signals": [],
      "deterministic_inputs": [
        "pipeline_결제_수수료_pivot_피벗_테이블11",
        "rel_결제_수수료_pivot_피벗_테이블11__pivot_cache_source"
      ],
      "evidence_refs": [
        "gate_target_결제_수수료_pivot_피벗_테이블11_pivot_cache_visual_alignment",
        "pipeline_결제_수수료_pivot_피벗_테이블11",
        "rel_결제_수수료_pivot_피벗_테이블11__pivot_cache_source"
      ],
      "notes": "pivot_cache_visual_alignment requires review: capture_required."
    },
    {
      "id": "result_gate_target_결제_수수료_pivot_피벗_테이블12_pivot_cache_visual_alignment",
      "type": "cross_validation_gate_result",
      "gate_check_id": "gate_target_결제_수수료_pivot_피벗_테이블12_pivot_cache_visual_alignment",
      "target_id": "target_결제_수수료_pivot_피벗_테이블12",
      "gate_type": "pivot_cache_visual_alignment",
      "status": "review_required",
      "reason": "capture_required",
      "confidence": 0.25,
      "target_type": "pipeline_output",
      "sheet": "결제&수수료",
      "range": "A214:B217",
      "feature_result_id": null,
      "feature_status": null,
      "layout_signals": [],
      "deterministic_inputs": [
        "pipeline_결제_수수료_pivot_피벗_테이블12",
        "rel_결제_수수료_pivot_피벗_테이블12__pivot_cache_source"
      ],
      "evidence_refs": [
        "gate_target_결제_수수료_pivot_피벗_테이블12_pivot_cache_visual_alignment",
        "pipeline_결제_수수료_pivot_피벗_테이블12",
        "rel_결제_수수료_pivot_피벗_테이블12__pivot_cache_source"
      ],
      "notes": "pivot_cache_visual_alignment requires review: capture_required."
    },
    {
      "id": "result_gate_target_결제_수수료_pivot_피벗_테이블13_pivot_cache_visual_alignment",
      "type": "cross_validation_gate_result",
      "gate_check_id": "gate_target_결제_수수료_pivot_피벗_테이블13_pivot_cache_visual_alignment",
      "target_id": "target_결제_수수료_pivot_피벗_테이블13",
      "gate_type": "pivot_cache_visual_alignment",
      "status": "review_required",
      "reason": "capture_required",
      "confidence": 0.25,
      "target_type": "pipeline_output",
      "sheet": "결제&수수료",
      "range": "A221:B224",
      "feature_result_id": null,
      "feature_status": null,
      "layout_signals": [],
      "deterministic_inputs": [
        "pipeline_결제_수수료_pivot_피벗_테이블13",
        "rel_결제_수수료_pivot_피벗_테이블13__pivot_cache_source"
      ],
      "evidence_refs": [
        "gate_target_결제_수수료_pivot_피벗_테이블13_pivot_cache_visual_alignment",
        "pipeline_결제_수수료_pivot_피벗_테이블13",
        "rel_결제_수수료_pivot_피벗_테이블13__pivot_cache_source"
      ],